Tên bài tập,Môn học,Ngày bắt đầu,Ngày kết thúc
Quiz 1 Học Máy,HỌC MÁY,20/12/2022 12:00:00,21/12/2022 23:59
Quiz 2 Học Máy,HỌC MÁY,22/12/2022 07:00,22/12/2022 23:59
Quiz 1 Xử lý ảnh,XỬ LÝ ẢNH,14/12/2022 00:00,20/12/2022 23:59
Quiz 1 Xử lý ngôn ngữ tự nhiên,XỬ LÝ NGÔN NGỮ TỰ NHIÊN,17/12/2022 00:00,12/12/2022 23:59
Assignment 1,KIỂM TRA PHẦN MỀM,14/12/2022 00:00,31/01/2023 23:59
Assignment 1,ĐỒ ÁN CHUYÊN NGÀNH,14/11/2022 00:00,25/12/2022 23:59
Quiz 1 Kiểm tra phần mềm,KIỂM TRA PHẦN MỀM,06/12/2022 15:00,19/12/2022 11:10
Bài tập mở đầu,XỬ LÝ ẢNH,01/12/2022 00:00,14/12/2022 11:10
